{
  "completeness": {
    "gaps": [],
    "status": "complete"
  },
  "graphs": [
    {
      "id": "main",
      "structure": {
        "edges": [
          {
            "id": "edge:__start__:a:direct:1",
            "kind": "direct",
            "source": "__start__",
            "target": "a"
          },
          {
            "id": "edge:__start__:b:direct:1",
            "kind": "direct",
            "source": "__start__",
            "target": "b"
          },
          {
            "id": "edge:sink:__end__:direct:1",
            "kind": "direct",
            "source": "sink",
            "target": "__end__"
          }
        ],
        "entryNodeIds": [
          "__start__"
        ],
        "exitNodeIds": [
          "__end__"
        ],
        "joins": [
          {
            "id": "join:a+b:sink",
            "sources": [
              "a",
              "b"
            ],
            "target": "sink"
          }
        ],
        "nodes": [
          {
            "id": "__end__"
          },
          {
            "id": "__start__"
          },
          {
            "id": "a"
          },
          {
            "id": "b"
          },
          {
            "id": "sink"
          }
        ]
      }
    }
  ],
  "producerLimitations": [],
  "provenance": {
    "framework": {
      "name": "conformance-fixture",
      "version": "1"
    },
    "generatedAt": "2000-01-01T00:00:00Z",
    "producer": {
      "name": "agent-topology-conformance",
      "version": "1"
    },
    "source": {
      "kind": "conformance-fixture",
      "locator": "join-permuted-sources"
    }
  },
  "structureHash": {
    "algorithm": "sha256",
    "algorithmVersion": "1",
    "value": "2544fc969e2cf3dd51761e2c7c5d1daac7a25e58b15f4e41ba5ad1802f8e487e"
  },
  "topologyVersion": "0.1"
}
