{
  "completeness": {
    "gaps": [
      {
        "code": "unknown-routing-targets",
        "element": {
          "graphId": "main",
          "id": "router",
          "kind": "node"
        },
        "message": "Not every destination of this router could be determined."
      }
    ],
    "status": "incomplete"
  },
  "graphs": [
    {
      "id": "main",
      "structure": {
        "edges": [
          {
            "id": "edge:__start__:router:direct:1",
            "kind": "direct",
            "source": "__start__",
            "target": "router"
          },
          {
            "id": "edge:target:__end__:direct:1",
            "kind": "direct",
            "source": "target",
            "target": "__end__"
          }
        ],
        "entryNodeIds": [
          "__start__",
          "target"
        ],
        "exitNodeIds": [
          "__end__"
        ],
        "joins": [],
        "nodes": [
          {
            "id": "__end__"
          },
          {
            "id": "__start__"
          },
          {
            "id": "router"
          },
          {
            "id": "target"
          }
        ]
      }
    }
  ],
  "producerLimitations": [],
  "provenance": {
    "framework": {
      "name": "conformance-fixture",
      "version": "1"
    },
    "generatedAt": "2000-01-01T00:00:00Z",
    "producer": {
      "name": "agent-topology-conformance",
      "version": "1"
    },
    "source": {
      "kind": "conformance-fixture",
      "locator": "unknown-routing-targets"
    }
  },
  "structureHash": {
    "algorithm": "sha256",
    "algorithmVersion": "1",
    "value": "00da965b2172598b239ab27d7a48c105b3a9d815ac139e7f629fa00e23f057b8"
  },
  "topologyVersion": "0.1"
}
