{
  "completeness": {
    "gaps": [],
    "status": "complete"
  },
  "graphs": [
    {
      "id": "main",
      "structure": {
        "edges": [
          {
            "id": "edge:__start__:left:direct:1",
            "kind": "direct",
            "source": "__start__",
            "target": "left"
          },
          {
            "id": "edge:__start__:right:direct:1",
            "kind": "direct",
            "source": "__start__",
            "target": "right"
          },
          {
            "id": "edge:joined:__end__:direct:1",
            "kind": "direct",
            "source": "joined",
            "target": "__end__"
          }
        ],
        "entryNodeIds": [
          "__start__"
        ],
        "exitNodeIds": [
          "__end__"
        ],
        "joins": [
          {
            "id": "join:left+right:joined",
            "sources": [
              "left",
              "right"
            ],
            "target": "joined"
          }
        ],
        "nodes": [
          {
            "id": "__end__"
          },
          {
            "id": "__start__"
          },
          {
            "id": "joined"
          },
          {
            "id": "left"
          },
          {
            "id": "right"
          }
        ]
      }
    }
  ],
  "producerLimitations": [],
  "provenance": {
    "framework": {
      "name": "conformance-fixture",
      "version": "1"
    },
    "generatedAt": "2000-01-01T00:00:00Z",
    "producer": {
      "name": "agent-topology-conformance",
      "version": "1"
    },
    "source": {
      "kind": "conformance-fixture",
      "locator": "multi-source-join"
    }
  },
  "structureHash": {
    "algorithm": "sha256",
    "algorithmVersion": "1",
    "value": "7349a60932bf7e969a6295ed586620989ed86a0cf84a13a205b1f707c07b39eb"
  },
  "topologyVersion": "0.1"
}
