{
  "completeness": {
    "gaps": [],
    "status": "complete"
  },
  "graphs": [
    {
      "id": "main",
      "structure": {
        "edges": [
          {
            "id": "edge:__start__:router:direct:1",
            "kind": "direct",
            "source": "__start__",
            "target": "router"
          },
          {
            "id": "edge:left:__end__:direct:1",
            "kind": "direct",
            "source": "left",
            "target": "__end__"
          },
          {
            "id": "edge:right:__end__:direct:1",
            "kind": "direct",
            "source": "right",
            "target": "__end__"
          },
          {
            "id": "edge:router:left:conditional:1",
            "kind": "conditional",
            "source": "router",
            "target": "left"
          },
          {
            "id": "edge:router:right:conditional:1",
            "kind": "conditional",
            "source": "router",
            "target": "right"
          }
        ],
        "entryNodeIds": [
          "__start__"
        ],
        "exitNodeIds": [
          "__end__"
        ],
        "joins": [],
        "nodes": [
          {
            "id": "__end__"
          },
          {
            "id": "__start__"
          },
          {
            "id": "left"
          },
          {
            "id": "right"
          },
          {
            "id": "router"
          }
        ]
      }
    }
  ],
  "producerLimitations": [],
  "provenance": {
    "framework": {
      "name": "conformance-fixture",
      "version": "1"
    },
    "generatedAt": "2000-01-01T00:00:00Z",
    "producer": {
      "name": "agent-topology-conformance",
      "version": "1"
    },
    "source": {
      "kind": "conformance-fixture",
      "locator": "conditional-routing"
    }
  },
  "structureHash": {
    "algorithm": "sha256",
    "algorithmVersion": "1",
    "value": "3726e22eeabf0574d5719fbf0d929e9be6f335b4e7e740c1182b03080136ae5c"
  },
  "topologyVersion": "0.1"
}
