{
  "completeness": {
    "gaps": [],
    "status": "complete"
  },
  "graphs": [
    {
      "id": "main",
      "structure": {
        "edges": [
          {
            "id": "edge:__start__:a:direct:1",
            "kind": "direct",
            "source": "__start__",
            "target": "a"
          },
          {
            "id": "edge:__start__:b:direct:1",
            "kind": "direct",
            "source": "__start__",
            "target": "b"
          },
          {
            "id": "edge:a:sink:direct:1",
            "kind": "direct",
            "source": "a",
            "target": "sink"
          },
          {
            "id": "edge:b:sink:direct:1",
            "kind": "direct",
            "source": "b",
            "target": "sink"
          },
          {
            "id": "edge:sink:__end__:direct:1",
            "kind": "direct",
            "source": "sink",
            "target": "__end__"
          }
        ],
        "entryNodeIds": [
          "__start__"
        ],
        "exitNodeIds": [
          "__end__"
        ],
        "joins": [],
        "nodes": [
          {
            "id": "__end__"
          },
          {
            "id": "__start__"
          },
          {
            "id": "a"
          },
          {
            "id": "b"
          },
          {
            "id": "sink"
          }
        ]
      }
    }
  ],
  "producerLimitations": [],
  "provenance": {
    "framework": {
      "name": "conformance-fixture",
      "version": "1"
    },
    "generatedAt": "2000-01-01T00:00:00Z",
    "producer": {
      "name": "agent-topology-conformance",
      "version": "1"
    },
    "source": {
      "kind": "conformance-fixture",
      "locator": "independent-incoming-edges"
    }
  },
  "structureHash": {
    "algorithm": "sha256",
    "algorithmVersion": "1",
    "value": "8142f48c8db30de8dd76302c07a5c55d9d3c6ed41c690c95d52a2fe9e06245a2"
  },
  "topologyVersion": "0.1"
}
